,comment,taste,service,mood,cospa,negaposi
66,厳しいコロナ禍に安心して頂ける環境の提供を深謝します。非常に美味しかったです。またお伺える日を楽しみにして居ます。,5,5,5,5,0.5
67,"友人の誕生日で利用しました。
3歳の子供も一緒だったのですが、子供用メニューも豊富でよかったです。
写真もスタッフさんからお声をかけていただき、気遣いにとても感謝いたします。",5,5,5,5,1.0
68,"今迄に大阪、東京のリッツを利用させて頂きましたが、京都は食事だけの利用でした。
一番上品で落ち着きました。
料理もランチでしたが、私たち母娘には丁度よい量で美味しく頂きました。
好みですが私たちには少し薄味だったので4.5にさせて頂きました。
サービスもさすがリッツと思え大満足でした。
今迄京都のリッツは敷居が高いと思っていたのですが、 次回は宿泊で利用させて頂きたいと思っています。",4.5,5,5,5,0.5
69,"当日に予約させて頂きました。
コースの説明も分かりやすく，料理に合うワインもセレクトして頂き美味しくゆったり食事することが出来ました。又リピートしたいです。",5,5,5,5,0.3333333333333333
